rating,review
5.0,줄이 길지만 금방 빠집니다. 키오스크로 주문하고 옆에서 대기해서 받아가면 되는데 생각보다 금방 빠져요.맛있어요. 가족 모임에 사갔는데 어른들도 맛있게 드셨어요. 선물도 했는데 선물 받은 사람도 맛있다고 했어요.보통 소금빵 보다는 덜 짜요. 짠맛이 강하진 않습니다. 그리고 버터가 많이 들어있어요. 입맛에 따라 기름지다고 느낄 수도 있을 거 같아요. 그래도 개인적으론 맛있게 먹어서 한번씩 사러 가요.조금 아쉬운 건 4개 세트로만 파는 것. 그게 제일 아쉬워요.
5.0,줄 길지만 금방빠짐소금빵은 맛있어요~~
2.0,평소에 식빵에 버터 가득 해서 구워먹는 걸 좋아하는 데 먹자마자 딱 그 맛이였음 가기 귀찮은데 맛 궁금한 사람은 후라이팬에 식빵 앞 뒤로 버터에 가득 해서 구워서 드셈 서울우유 버터 써도 됨 결론은 소금빵 자체로써 특별한 점은 못 느낌.그리고 마케팅 하려고 일부러 늦게 주는 거임? 뒤에 줄 서 있을 땐 갓 만든 빵 따뜻하게 바로바로 주려고 오래걸리나보다 싶었는데 사람 좀 줄어들고 앞에 두팀 있는데 진짜 개느리게 줌; 빵이 없는 것도 아님 뒤에 포장된 빵 개많이 쌓여있음. 알바 두 명 있던데 두명중 한 명은 좀 빨리 빨리 손님 응대를 해야되는데 중간 중간 같이 빵포장 하고있음; 포장빵이 쌓여있음에도 불구하고. 진짜 뭐지 싶은 ㅡㅡ 빵은 심지어 차가움 빵 식은 거? 그럴 수 있음 짜증나는 건 빵이 따뜻한 것도 아니고 포장된 빵이 쌓여있는데도 왜 빵을 바로바로 안 주냐 이거임 결제도 미리 옆에서 다 한거고 빵 주는 거 그거 5초도 안 걸리는데 뭐 한다고 한팀당 몇분씩 잡아먹는 건지 도통 이해가 안 감
2.0,괜히 2봉지나 샀네요.동네 빵집과 차이가 없어요. 지극히 평범해요. 봉투빨이에요.
5.0,
4.0,"가야는이유 : 인천에서 시작된 브랜딩된 소금빵안가는이유 : 소금빵 넘버원은 아닌소금빵 : 더 인상적인 소금빵은 많았지만 굳이 깎아내릴것 없는 맛으로 모든 면이 안정적인, 선물용으로 더 적합해 보이기도4개셋트로만 판매하고 키오스크 주문 후 수령줄서기를 해야하는데 종종 주문안하고 기다리다 다시 주문하러 가는 사람이 있기도, 연휴 낮에 방문했을때도 대기는 많지 않았던"
2.0,저도 결제하기 전에 아래 분처럼 봉투 하나만 주시면 안 되냐고 물어보니 결제 도와주시는 분이 당연히 가능하다고 하심. 픽업할 때 물어보면 주실 거라고 해서 결제 마치고 픽업 라인 서서 기다리고 보니 또 픽업 도와주시는 분은 봉투 절대 못 준다고 함ㅋㅋㅋㅋ봉투 금으로 만드셨나요.. 된다고 했다가 안된다고 했다가 난리 난리
1.0,소금빵을 4개씩 1세트로 팔길래 친구랑 두개씩 나눠가져갈려고 봉투하나 주실수 잇냐고 물어봤는데 여자직원분이 ’절대로 못드려요‘라고 말해서 기분이 너무 나빴어요. 차라리 봉투를 돈주고 사라고 말해주셨으면 좋았을텐데 대뜸 그런식으로 말씀하시니 기분 팍 상하더라구요. 두개씩 포장해달라는것도 아니고 걍 봉투 하나 더 달라는건데 그거하나주는게 뭐가 어렵다고;; 그리고 소금빵도 특별한 맛도 아니고 걍 평범하고 느끼해요. 왜 사람많고 줄서있는지 1도 모르겠음
5.0,소금빵의 맛에 대한 내 기준이 바꼈다
5.0,돌아다니다가 줄이 길게 서 있길래 저긴 뭐지?하고 먹어봤는데 JMT.. 엄청 쫀득하고 맛있엇어요~~줄도 금방 줄어서 기다릴만 합니다! 강추강추 담에 꼭 또 먹을거에요
4.0,항상 줄은서지만 길진 않아요.
5.0,본점이랑 맛 동일해요 진짜 맛있습니다 따뜻할 때 꼭 드셔보세요
5.0,버터 미침 촉촉한 소금빵... 존맛
5.0,빵을 그닥 안좋아하는 1인. 카페가면 무조건 커피만 시켜먹음. 성수 지나가다 호기심에 뭐 얼마나 맛있나하고 사봄. ㄹㅇ개맛있음... 이거먹고 카페가면 소금빵만 찾음 ㅠ
5.0,𝙈𝙄𝘾𝙃𝙄𝙉 진짜 대대대대대대대대대ㅐ댇존맛 이제껏 먹은 소굼빵중에 제일 맛있음 진쩌 미쳐버린 소금빵임 다들 드세요
5.0,우왓!! 이 빵 모에요!! 🥐🥐🥐🥐 진짜 진짜 맛있어요!!성수동 지나가다가 사람들이 줄서있어서 사먹어봤눈뎅 뿌엥 넘맛 대맛!! 다음엔 마니 사서 냉동실에 쟁여놓고 한개씩 꺼내먹을래요 😭세상에 하루지나서 데우지도 않고 오늘 아침에 먹었는데 바닥이 바삭한 이건 소금빵 좋아해서 마니 사먹어봤지만 없어요~~~ 버터를 아끼지 않고 팍팍팍!! 먹고나서도 버터향이 솔솔 나는것 같아요.다음엔 앉아서 커피랑 즐길수 있는 익선동으로 갑니닷!4개 세트 ₩12000
5.0,그냥 유행하는 소금빵이겠거니 했는데 제가 먹어본 소금빵 중 젤 맛있어요! 버터향도 진하고 소금도 뭔가 달라요. 색이 진하더라구요? 맛있을 수 밖에 없는게 시간별로 바로 빵이 구워나오니 항상 제일 맛있는 빵을 살수 있어요. 4개 한세트 인데 금방 먹어요 ㅎㅎㅎ 절대 한개만 살 수 없어요. 성수 올때마다 사갈거예요! 그리고 포장이 친환경적인것두 매우매우 맘에들어요.
4.0,기름져서 내타입인데 왜 세트로밖에 안팔지?억지로 세트 사야댐
3.0,낫띵 스페셜 맛있긴함
5.0,너무 맛있다 와 역대급갓나온 뜨거운 소금빵에 버터가 쪼아아악 나오고 쫀득함
5.0,굿굿 소금빵치고 기름진편
